{
  "task_id": "weekly-check-seconds",
  "task_version": 1,
  "run_id": "run-9743cb0f1ec64db2b2d8b1eb48d8cb5e",
  "source_sha256": "885831168aa322be9f94499b5f3583557efe6f18d4a3707e63ac1c87d648ab90",
  "completed_ids": [
    "C-101",
    "C-102",
    "C-104"
  ],
  "count": 3,
  "total_seconds": 6.0,
  "mean_seconds": 2.0
}
